{
  "schema": "factory-evidence-v1",
  "repository": "DanWahlin/aimarket-factory-journey-lab",
  "runId": "run-123",
  "taskId": "F15",
  "commitSha": "1111111111111111111111111111111111111111",
  "startedAt": "2026-08-21T00:00:00.000Z",
  "completedAt": "2026-08-21T00:01:00.000Z",
  "status": "PASS",
  "producerRunId": "123456",
  "policyVersion": "v1",
  "artifactHashes": {
    "checksSha256": "9c525cefceec3abe6f43340c62638a470b490e1826fd11ca551db40498fb8dc3",
    "metricsSha256": "70e583be320f5767534765d6e2d724f65178aa61941b4dea70f5f41f65e56f06"
  },
  "checks": [{ "name": "health", "status": "PASS" }],
  "ownership": {
    "resourceGroup": "aimarket-factory-run-123",
    "resourceGroupHash": "aaaaaaaaaaaaaaaaaaaaaaaaaaaaaaaaaaaaaaaaaaaaaaaaaaaaaaaaaaaaaaaa"
  },
  "cleanup": { "status": "PENDING" },
  "metrics": { "canonicalProductCount": 10 }
}
